[
  {
    "id": "sw-auth-authentication",
    "term": "authentication",
    "sourceLanguage": "en",
    "preferredKhmer": "ការផ្ទៀងផ្ទាត់អត្តសញ្ញាណ",
    "alternativeKhmer": ["ការផ្ទៀងផ្ទាត់"],
    "domain": "software",
    "context": "Security and user login",
    "partOfSpeech": "noun",
    "examples": [
      {
        "source": "User authentication is required to access this resource.",
        "khmer": "តម្រូវឱ្យមានការផ្ទៀងផ្ទាត់អត្តសញ្ញាណអ្នកប្រើប្រាស់ដើម្បីចូលប្រើប្រាស់ធនធាននេះ។",
        "notes": "Access control dialog"
      }
    ],
    "usageNotes": "Always prefer 'ការផ្ទៀងផ្ទាត់អត្តសញ្ញាណ' over literal or phonetic transliteration. When distinguishing from authorization, this verifies *who* the user is.",
    "status": "draft",
    "provenance": {
      "sourceType": "community",
      "reference": "Seed data; source not yet documented",
      "reviewedBy": [],
      "lastUpdated": "2026-09-28"
    }
  },
  {
    "id": "sw-auth-authorization",
    "term": "authorization",
    "sourceLanguage": "en",
    "preferredKhmer": "ការផ្ដល់សិទ្ធិ",
    "alternativeKhmer": ["ការអនុញ្ញាតសិទ្ធិ"],
    "domain": "software",
    "context": "Access control and permissions",
    "partOfSpeech": "noun",
    "examples": [
      {
        "source": "You do not have authorization to view this page.",
        "khmer": "អ្នកមិនមានការផ្ដល់សិទ្ធិដើម្បីមើលទំព័រនេះទេ។",
        "notes": "HTTP 403 Forbidden screen"
      }
    ],
    "usageNotes": "Authentication is 'ការផ្ទៀងផ្ទាត់អត្តសញ្ញាណ' (who you are), while authorization is 'ការផ្ដល់សិទ្ធិ' (what you are allowed to do). Do not confuse the two.",
    "status": "draft",
    "provenance": {
      "sourceType": "community",
      "reference": "Seed data; source not yet documented",
      "reviewedBy": [],
      "lastUpdated": "2026-09-28"
    }
  },
  {
    "id": "sw-auth-password",
    "term": "password",
    "sourceLanguage": "en",
    "preferredKhmer": "ពាក្យសម្ងាត់",
    "alternativeKhmer": [],
    "domain": "software",
    "context": "User credential",
    "partOfSpeech": "noun",
    "examples": [
      {
        "source": "Enter your password to proceed.",
        "khmer": "បញ្ចូលពាក្យសម្ងាត់របស់អ្នកដើម្បីបន្ត។",
        "notes": "Login form instruction"
      }
    ],
    "usageNotes": "Universal standard term nationwide. Never transliterate as 'ប៉ាសវើត'.",
    "status": "draft",
    "provenance": {
      "sourceType": "community",
      "reference": "Seed data; source not yet documented",
      "reviewedBy": [],
      "lastUpdated": "2026-09-28"
    }
  },
  {
    "id": "sw-auth-reset-password",
    "term": "reset password",
    "sourceLanguage": "en",
    "preferredKhmer": "កំណត់ពាក្យសម្ងាត់ឡើងវិញ",
    "alternativeKhmer": [],
    "domain": "software",
    "context": "Account recovery flow",
    "partOfSpeech": "phrase",
    "examples": [
      {
        "source": "Reset your password via email link.",
        "khmer": "កំណត់ពាក្យសម្ងាត់របស់អ្នកឡើងវិញតាមរយៈតំណភ្ជាប់អ៊ីមែល។",
        "notes": "Account recovery notification"
      }
    ],
    "usageNotes": "Standard phrasing for the password reset action.",
    "status": "draft",
    "provenance": {
      "sourceType": "community",
      "reference": "Seed data; source not yet documented",
      "reviewedBy": [],
      "lastUpdated": "2026-09-28"
    }
  },
  {
    "id": "sw-auth-two-factor-auth",
    "term": "two-factor authentication",
    "sourceLanguage": "en",
    "preferredKhmer": "ការផ្ទៀងផ្ទាត់អត្តសញ្ញាណពីរជំហាន",
    "alternativeKhmer": ["ការផ្ទៀងផ្ទាត់ពីរជំហាន", "ការផ្ទៀងផ្ទាត់ពីរកត្តា"],
    "domain": "software",
    "context": "Multi-factor security settings",
    "partOfSpeech": "noun",
    "examples": [
      {
        "source": "Enable two-factor authentication for extra security.",
        "khmer": "បើកដំណើរការការផ្ទៀងផ្ទាត់អត្តសញ្ញាណពីរជំហានសម្រាប់សុវត្ថិភាពបន្ថែម។",
        "notes": "Security settings recommendation"
      }
    ],
    "usageNotes": "'ការផ្ទៀងផ្ទាត់អត្តសញ្ញាណពីរជំហាន' is the most natural and widely used terminology (adopted by Google, Apple, and Telegram Khmer localization).",
    "status": "draft",
    "provenance": {
      "sourceType": "community",
      "reference": "Seed data; source not yet documented",
      "reviewedBy": [],
      "lastUpdated": "2026-09-28"
    }
  },
  {
    "id": "sw-auth-session",
    "term": "session",
    "sourceLanguage": "en",
    "preferredKhmer": "សម័យប្រើប្រាស់",
    "alternativeKhmer": ["វគ្គប្រើប្រាស់"],
    "domain": "software",
    "context": "User active session and timeouts",
    "partOfSpeech": "noun",
    "examples": [
      {
        "source": "Your session has expired. Please login again.",
        "khmer": "សម័យប្រើប្រាស់របស់អ្នកបានផុតកំណត់ហើយ។ សូមចូលម្តងទៀត។",
        "notes": "Session timeout alert"
      }
    ],
    "usageNotes": "In software UI, 'សម័យប្រើប្រាស់' or 'វគ្គប្រើប្រាស់' is preferred. Avoid using 'សមាជ' or pure transliteration.",
    "status": "draft",
    "provenance": {
      "sourceType": "community",
      "reference": "Seed data; source not yet documented",
      "reviewedBy": [],
      "lastUpdated": "2026-09-28"
    }
  },
  {
    "id": "sw-auth-permission",
    "term": "permission",
    "sourceLanguage": "en",
    "preferredKhmer": "សិទ្ធិអនុញ្ញាត",
    "alternativeKhmer": ["ការអនុញ្ញាត"],
    "domain": "software",
    "context": "Role-based access control and OS permissions",
    "partOfSpeech": "noun",
    "examples": [
      {
        "source": "Allow camera permission to scan QR code.",
        "khmer": "អនុញ្ញាតសិទ្ធិប្រើប្រាស់កាមេរ៉ាដើម្បីស្កេនលេខកូដ QR។",
        "notes": "Mobile OS permission request"
      }
    ],
    "usageNotes": "Use 'សិទ្ធិអនុញ្ញាត' for access privileges.",
    "status": "draft",
    "provenance": {
      "sourceType": "community",
      "reference": "Seed data; source not yet documented",
      "reviewedBy": [],
      "lastUpdated": "2026-09-28"
    }
  },
  {
    "id": "sw-auth-biometric-auth",
    "term": "biometric authentication",
    "sourceLanguage": "en",
    "preferredKhmer": "ការផ្ទៀងផ្ទាត់អត្តសញ្ញាណជីវមាត្រ",
    "alternativeKhmer": ["ការផ្ទៀងផ្ទាត់ជីវមាត្រ"],
    "domain": "software",
    "context": "Fingerprint / Face ID recognition",
    "partOfSpeech": "noun",
    "examples": [
      {
        "source": "Login using biometric authentication.",
        "khmer": "ចូលប្រើដោយប្រើការផ្ទៀងផ្ទាត់អត្តសញ្ញាណជីវមាត្រ។",
        "notes": "App sign-in option"
      }
    ],
    "usageNotes": "Standard scientific and technical term established by NCKL.",
    "status": "draft",
    "provenance": {
      "sourceType": "community",
      "reference": "Seed data; source not yet documented",
      "reviewedBy": [],
      "lastUpdated": "2026-09-28"
    }
  }
]
